entity,category1,category2,percent1,percent2,sentence,entity_start,entity_end
allikmaa,LOC,PER,50,50,"Kultuuriministeeriumi kantsler Margus Allikmaa on kindel , et selle raha eest , mida riik täna Eesti Raadio ja ETV peale kulutab , saab tunduvalt paremaid programme või üksiksaateid tellida erakanalitelt .",38,46
allikmaa,LOC,PER,50,50,"Eesti Draamateatri direktori valimise komisjoni kuuluvad kultuuriministeeriumi kantsler Margus Allikmaa , teatrinõunik Reet Weidebaum , eelarve osakonna juhataja Linda Sade , asekantsler kaunite kunstide alal Reet Mikkel , personalitalituse juhataja Evi Randoja , Eesti Teatrijuhtide Liidu liige Jaak Viller , Teatriliidu esimees Rein Oja , Riigikogu kultuurikomisjoni liige Paul-Erik Rummo , Eesti Draamateatri loomenõukogu liige , näitlejate usaldusisik Enn Nõmmik ja Tallinna Kultuuriväärtuste Ameti juhataja asetäitja Külli Holsting .",95,103
allikmaa,LOC,PER,50,50,"President Arnold Rüütel kirjutas täna õhtul Paslepas alla otsusele nimetada Margus Allikmaa valitsuse liikmeks , kultuuriministriks , teatas presidendi kantselei pressiteenistus .",83,91
allikmaa,LOC,PER,50,50,"Enne otsuse allkirjastamist kohtus president peaminister Siim Kallase ja Margus Allikmaaga , kellega kõneldi senisest tööst , olukorrast Eesti Kultuurkapitalis ning kultuuriteemadel laiemalt .",80,90
allikmaa,LOC,PER,50,50,"Kultuuriministeeriumi kantsler Margus Allikmaa tunnistas , et põhikirja tegemine on lõpujärgul . """,38,46
allikmaa,LOC,PER,50,50,"Sõnavõttudega astusid publiku ette järgemööda abilinnapea Margus Allikmaa , haridusameti juhataja Andres Pajula ja kesklinna vanem Keit Pentus .",65,73
allikmaa,LOC,PER,50,50,"Allikmaa : "" Margus Allikmaa toob oma lapsed kooli Viimsist , kuid linn , volikogu ja haridusamet tahavad ühtlast koolivõrgu arengut üle Tallinna . """,20,28
allikmaa,LOC,PER,50,50,"Ringhäälingunõukogu kutsus ETV juhiks kandideerima ka kultuuriministeeriumi kantslerit Margus Allikmaa ja personaliotsingufirma Fontes juhi Tõnis Arro , kuid nad keeldusid .",94,102
allikmaa,LOC,PER,50,50,"Kultuuriministeeriumi kantsler Margus Allikmaa on BNSile öelnud , et ETV-l pole oma arengu pärssimises mingit põhjust süüdistada valitsust , sest rahakärped puudutasid valusalt kõiki riiklikke struktuure .",38,46
allikmaa,LOC,PER,50,50,"AS Trio peadirektori Margus Allikmaa sõnul on "" Eva "" programm mõeldud kuulamiseks büroodes ja kauplustes .",28,36
allikmaa,LOC,PER,50,50,Näiteks Sulev Varet ja Margus Allikmaad seotakse selgelt Reformierakonnaga jne .,30,39
allikmaa,LOC,PER,50,50,"Komisjoni esimees , kultuuriministeeriumi kantsler Margus Allikmaa pidas võimalikuks Ugala uue juhi selgumist juba selsamal päeval , kuigi võimalik on ka kolmas voor .",58,66
allikmaa,LOC,PER,50,50,"Margus Allikmaa ei varjanud , et tema peab kõige tõenäolisemaks teatrijuhiks Jaak Allikut .",7,15
allikmaa,LOC,PER,50,50,Margus Allikmaa on Tallinna abilinnapea,7,15
allikmaa,LOC,PER,50,50,"Eile kohtusid teatriperega kultuuriministeeriumi kantsler Margus Allikmaa , osakonnajuhataja Reet Mikkel ja maavanem Helir-Valdor Seeder .",65,73
allikmaa,LOC,PER,50,50,"Margus Allikmaa ütles teatrirahvale , et loodetavasti on jõuludeks uus direktor ametis .",7,15
allikmaa,LOC,PER,50,50,"Mängijate nimekiri koos ürituse detailidega selgub suve jooksul , arvatavasti võib platsil näha Ilmar Raagi , Ivar Jurtshenkot , Eesti Raadio juhte Margus Allikmaad , Sulev Valnerit ja Hanno Tombergi .",155,164
allikmaa,LOC,PER,50,50,""" See on veel väga toores idee , mille puhul tuleb kaaluda kõiki sellega kaasnevaid plusse ja miinuseid nii emotsionaalsel kui majanduslikul tasandil , "" ütles kultuuriministeeriumi kantsler Margus Allikmaa ETAle . """,198,206
allikmaa,LOC,PER,50,50,"Pole ju Lipstok erand , kui mõelda Märt Raskile , Margus Allikmaale , Siim Kallasele , Signe Kivile .",57,67
allikmaa,LOC,PER,50,50,"TALLINN , 16. juuli ( EPLO ) - Nädalavahetusel tallinlasi ärkvel hoidnud tantsutrall Sun Dance Music Festival rikkus abilinnapea Margus Allikmaa hinnangul linlaste öörahu .",136,144
allikmaa,LOC,PER,50,50,PILVEVANAKE ehk abilinnapea Margus Allikmaa,35,43
allikmaa,LOC,PER,50,50,"Abilinnapea Margus Allikmaa sõnul on tänaseks selgusele jõutud , et sihtasutus on lauluväljaku edasiseks majandamiseks parim vorm . """,19,27
allikmaa,LOC,PER,50,50,"Kantsler Margus Allikmaa väitel kavatseb kultuuriministeerium seista jõuliselt tuleva aasta olulisemate eelarve-eelistuste - investeeringute - eest . """,16,24
allikmaa,LOC,PER,50,50,"Teatri sihtasutuse nõukogu esimees Margus Allikmaa ütles , et tehnilise juhi ametikoht oli tühi . """,42,50
allikmaa,LOC,PER,50,50,"Allikmaa ( abilinnapea Margus Allikmaa ) on kultuuriväärtuste ameti otsene ülemus , loodan , et ta paneb neile mõistuse pähe , "" avaldas Ermel .",30,38
allikmaa,LOC,PER,50,50,"Pädevaks võib pidada ka kultuuriministeeriumi kantslerit Margus Allikmaad , kes aastatel 1991-1998 oli Eesti Draamateatri direktor ja pärast seda AS-i Trio peadirektor .",64,73
allikmaa,LOC,PER,50,50,"Kultuuriminister Margus Allikmaa tundis muret , mis hakkab Mäe peale kõigi nende konjakitega , mis kihlvedude tagajärjel võitis . """,24,32
allikmaa,LOC,PER,50,50,"Konkursikomisjoni esimees on Kultuuriministeeriumi kantsler Margus Allikmaa ja liikmed Eesti Teatriliidu juhatuse esimees Jaak Allik , sihtasutuse "" Vanalinna teatrimaja "" juhataja Voldemar Promet , - "" Vanalinnastuudio "" direktor-loominguline juht Eino Baskin , "" Vanalinnastuudio "" näitleja Egon Nuter , Tallinna Linnateatri direktor Raivo Põldmaa , Kultuuriministeeriumi eelarve- ja majandusanalüüsi osakonna juhataja Linda Sade ja kunstide osakonna juhataja Reet Mikkel ning komisjoni sekretär , teatrinõunik Enn Kabrits .",67,75
allikmaa,LOC,PER,50,50,""" Peame võimalused üle vaatama , "" ütles ministeeriumi kantsler Margus Allikmaa .",71,79
allikmaa,LOC,PER,50,50,"Rahandusministeerium on aru saanud , et pole võimalik ringhäälingut programmi tootmiseks vajalikest vahenditest lahutada , lõviosa tehnikast kuulub ju maja juurde , "" sõnas Eesti Raadio juhatuse esimees Margus Allikmaa .",210,218
allikmaa,LOC,PER,50,50,"Margus Allikmaa sõnul on praeguseks kindel , et organisatsioon tuleb ühte hoonesse , Narva maanteel paikneva krundi saamiseks on taotlus juba esitatud . """,7,15
allikmaa,LOC,PER,50,50,Eesti Draamateatri Sihtasutuse nõukogu esimehe Margus Allikmaa sõnul on teatri majanduslik seis väga hea ning nõukogu asub ette valmistama avalikku konkurssi uue juhi leidmiseks .,54,62
allikmaa,LOC,PER,50,50,"Kultuuriministeeriumi kantsler Margus Allikmaa teatas Olav Mäele , et kultuuriministeerium andis lõpuks alles mullu detsembris kõik vajalikud dokumendid üle , lisades , et valitsuse 15. jaanuari istungil otsustatakse sihtasutuse moodustamine .",38,46
allikmaa,LOC,PER,50,50,"Siis oli Draamateatril veel tegus direktori-kallakuga juht , tänaseks kultuuriministeeriumi kantsleriks kerkinud Margus Allikmaa , kelle kõrvale oli aastaid otsitud just kunstilist juhti ehk siis pealavastajat .",120,128
allikmaa,LOC,PER,50,50,"Kultuuriministeeriumi kantsler Margus Allikmaa ütles , et kunagi ministeeriumi ja Tartu Kommertspanga poolt loodud Eliasega sõlmitud rendileping sisaldab tõepoolest kinnistu müügi puhul eelisõigust andvat sätet .",38,46
allikmaa,LOC,PER,50,50,"Kultuuriministeeriumi kantsler Margus Allikmaa sõnul on teatrite ühendamise plaan praegu staadiumis , kus idee on teatritele üksnes aruteluks välja käidud . """,38,46
allikmaa,LOC,PER,50,50,Abilinnapea Margus Allikmaa sõnul peaks summa ka järgneval aastal samasse mahtu jääma .,19,27
allikmaa,LOC,PER,50,50,"Abilinnapea Margus Allikmaa osutas , et hiljem sai investeeringukavasse lisatud punkt , et kava viiakse ellu vastavalt linna tegelikele võimalustele .",19,27
allikmaa,LOC,PER,50,50,"Keegi neist ei pääse ligilähedalegi Draamateatri peahelitehnikule Jaan Allikmaale , kes sai eile 60-aastaseks ja kes 40 aastat on õhtust õhtusse oma helipuldis saatnud Draamateatri lavadel toimuvat .",71,81
allikmaa,LOC,PER,50,50,"Kui tänane kultuuriministeeriumi kantsler Margus Allikmaa 1981. aastal tudengina Draamateatrisse lavapoisiks tuli , oli tema onu Jaan seal heli sättinud juba paarkümmend aastat .",49,57
allikmaa,LOC,PER,50,50,"Just Jaan Allikmaa see oligi , kes teda teatrisse kutsus . """,10,18
allikmaa,LOC,PER,50,50,""" Hirmkohusetundik , "" ütleb Jaan Allikmaa kohta põlvkonna- ja teatristaazhikaaslane Ita Ever . """,34,42
allikmaa,LOC,PER,50,50,40 aastat koos Jaan Allikmaaga teatrit teinud tehnikadirektor Ain Jürisson kinnitab : tolle energilise ja vuntsi muigava profi peale võib sõnatult kindel olla igas kriitilisimaski situatsioonis .,20,30
allikmaa,LOC,PER,50,50,"Jaan Allikmaa peale võib muide kindel olla ka siis , kui kõik läheb hästi : ta ei jäta head sõna ülemata , pidu pidamata , tantsimata , rõõmu jagamata ! """,5,13
allikmaa,LOC,PER,50,50,Jaan Allikmaa 60,5,13
allikmaa,LOC,PER,50,50,""" Kõik kolm kandidaati oleks oma rolli ilusti välja mänginud , aga Margus Allikmaaga on seotud väikseimad riskid , "" ütles Kreitzberg ning lisas , et imekombel suutis nõukogu otsuse langetada esimese hääletusvooruga .",74,84
allikmaa,LOC,PER,50,50,"Kultuuriministeeriumi kantsler Margus Allikmaa ütles , et kuni asi pole seadusega reguleeritud , võtavad nad inimese tööle erialase professionaalsuse järgi ja sõltumata sellest , kas ta on kaitseväes käinud või mitte .",38,46
allikmaa,LOC,PER,50,50,"Uude juhatusse valiti Margus Allikmaa , Rein Lang , Maret Maripuu , Tatjana Muravjova , Toivo Ninnas , Urmas Paet , Ülle Rajasalu ja Anders Tsahkna .",29,37
allikmaa,LOC,PER,50,50,Kultuuriministeeriumi kantsleri Margus Allikmaa väitel räägib ta täna Mikiveriga Kuressaare teatrisse asumise ja teatri tuleviku teemadel .,39,47
allikmaa,LOC,PER,50,50,"Kultuuriministeeriumi kantsler Margus Allikmaa ütles , et riigilt Draamateater raha juurde ei saa . """,38,46
allikmaa,LOC,PER,50,50,"Üks on aga kindel - ETV juhatusse ta enam ei kuuluda ei taha , hoolimata uue ringhäälingu juhi Margus Allikmaa sellekohasest soovist . """,102,110
allikmaa,LOC,PER,50,50,"President Arnold Rüütel nimetas reede õhtul kultuuriministriks senise kultuuriministeeriumi kantsleri , Reformierakonda kuuluva Margus Allikmaa ( 41 ) .",135,143
allikmaa,LOC,PER,50,50,"Enne otsuse allkirjastamist kohtus president peaminister Siim Kallase ja Margus Allikmaaga , kellega kõneldi senisest tööst ja olukorrast kultuurkapitalis , teatas presidendi kantselei .",80,90
allikmaa,LOC,PER,50,50,"Kultuuriminister Margus Allikmaa määras 2003. aasta riigi kultuuristipendiumid 11 inimesele , tähtajaks laekus 74 avaldust .",24,32
allikmaa,LOC,PER,50,50,"Linnapea Edgar Savisaar ning abilinnapead Toivo Ninnas ja Margus Allikmaa kohtusid juuni algul detailplaneeringu autoritega ning arhitektide liidu esindajatega , et tuua selgust ala detailplaneeringu jätkamise võimalustesse .",65,73
allikmaa,LOC,PER,50,50,"Tema läheb eesti kultuurilukku sellega , et lasi kultuurkapitali tegevdirektoril Avo Viiolil kapitali paljaks varastada ja oma kantsleril Margus Allikmaal müüa riigile kuuluv Saarineni maja 80 miljoni krooni eest kinnisvaraärimees Margus Fingile .",145,154
allikmaa,LOC,PER,50,50,Elas kord Margus Allikmaa .,17,25
allikmaa,LOC,PER,50,50,"Draamateater töötas pikka aega Margus Allikmaa käe all ja kogu aeg oli kosta nurinat , et meil oleks vaja ideoloogilist telge , ideoloogilist juhti .",38,46
allikmaa,LOC,PER,50,50,"“ Komisjonile oli suur üllatus , et päris võrdseid variante oli mitmeid , ” ütles komisjoni esimees , kultuuriministeeriumi kantsler Margus Allikmaa .",140,148
allikmaa,LOC,PER,50,50,Veel rikub nummerdamata ja kohapeal löödud hinnaga piletite müük raamatupidamisseadust ning loob kultuuriministeeriumi kantsleri Margus Allikmaa sõnul võimaluse käibemaksupettuseks .,136,144
allikmaa,LOC,PER,50,50,"Teatri direktorit valinud komisjoni kuulusid kultuuriministeeriumi kantsler Margus Allikmaa , teatriliidu juhatuse esimees Jaak Allik , sihtasutuse Vanalinna Teatrimaja juhataja Voldemar Promet , Vanalinnastuudio direktor-loominguline juht Eino Baskin , näitleja Egon Nuter , Linnateatri direktor Raivo Põldmaa ning ministeeriumist Linda Sade , Reet Mikkel ja Enn Kabrits .",83,91
allikmaa,LOC,PER,50,50,Olukord on kurb ning minister Margus Allikmaa jutt kultuuriparemast käekäigust tulevikus mõjub kui roosamanna .,37,45
allikmaa,LOC,PER,50,50,"Kantsleri kohalt Signe Kivi asemele ministriks tõusnud Margus Allikmaa ütles BNSile , et teeb valitsusele ettepaneku Sukles ametisse määrata niipea , kui viimane on lõpetanud Kultuurkapitalis oma töö . """,62,70
allikmaa,LOC,PER,50,50,Kultuuriministeeriumi teatel teeb Allikmaa valitsusele ettepaneku Sukles kantsleriks nimetada alates 1. novembrist .,34,42
allikmaa,LOC,PER,50,50,"Kui rahvusringhäälingu juhi otsimiseks kuulutatakse välja konkurss , pürgivad sellele kohale praegune Eesti Raadio juhatuse esimees Margus Allikmaa ja juhatuse liige Sulev Valner , kuid tõenäolisem on , et uus juht selgub konkursita .",139,147
allikmaa,LOC,PER,50,50,"Eesti Päevalehe andmetel on poliitiliselt juba otsustatud , et rahvusringhäälingu juhiks saab Margus Allikmaa .",101,109
allikmaa,LOC,PER,50,50,"Kultuuriminister Margus Allikmaa andis ammendava vastuse , et kui raha tema valitsusalasse antakse , võtab ta selle vastu . """,24,32
allikmaa,LOC,PER,50,50,Lisaks senisele peadirektorile Himmale kandideeris Rahvusooperi peadirektoriks ka Eesti Draamateatri juht Margus Allikmaa .,113,121
allikmaa,LOC,PER,50,50,"Hääled jagunesid kuus viie vastu ja mitmed nõukogu liikmed olid seisukohal , et Margus Allikmaa kontseptsioon oli intensiivsem , radikaalsem ja kiiremaid ümberkorraldusi tõotav , "" ütles Olesk . """,87,95
allikmaa,LOC,PER,50,50,Festivali sõidavad avama kultuuriministeeriumi kantsler Margus Allikmaa ja Eesti Instituudi direktor Lore Listra .,63,71
allikmaa,LOC,PER,50,50,"Kultuuriminister Margus Allikmaa kinnitas muuseuminõukogu uue koosseisu , sest põhimäärusest tulenevalt lõppesid nõukogu esimehe ja aseesimehe volitused , lisaks ei osalenud mõned liikmed nõukogu töös .",24,32
allikmaa,LOC,PER,50,50,""" Tallinna lauluväljaku staatuse muutmine on olnud päevakorras juba mitmeid aastaid , "" teatas abilinnapea Margus Allikmaa Raepressi vahendusel . """,114,122
allikmaa,LOC,PER,50,50,""" See on veel väga toores idee , mille puhul tuleb kaaluda kõiki sellega kaasnevaid plusse ja miinuseid nii emotsionaalsel kui majanduslikul tasandil , "" ütles kultuuriministeeriumi kantsler Margus Allikmaa ETAle . """,198,206
allikmaa,LOC,PER,50,50,"Kultuuriministeeriumi kantsler Margus Allikmaa väitis koguni end olevat vale inimese , kelle käest küsida , miks siis ikkagi on vaja Akadeemilist raamatukogu reorganiseerida .",38,46
allikmaa,LOC,PER,50,50,"Ning siis võib Raua-preemia pähe sadada hoopis elektroonik Margus Allikmaale , kes praegu kantslerina dirigeerib meie kultuuririnnet .",66,76
allikmaa,LOC,PER,50,50,Erakonna esimene nimekiri formuleeriti draamateatri toonase juhi Margus Allikmaa sekretariaadis .,72,80
allikmaa,LOC,PER,50,50,Kantsler Margus Allikmaa esitas valitsusele kultuuriministeeriumi ettepanekud avalik-õigusliku ringhäälingu korrastamiseks .,16,24
allikmaa,LOC,PER,50,50,"Eesti Televisioonile ( ETV ) uue juhi leidmiseks korraldatud konkursi ebaõnnestumisel kaalub ringhäälingunõukogu pakkumise tegemist Ilmar Raagile , Margus Allikmaale ja Tõnis Arrole .",155,165
allikmaa,LOC,PER,50,50,"Margus Allikmaa ütles , et kui talle tehakse sihtpakkumine , peab ta selle kõigepealt ära kuulama ning seejärel otsustama . """,7,15
allikmaa,LOC,PER,50,50,Kuid Põlva linnavolikogu aseesimees ja Riigikogu liige Georg Pelisaar arutas küsimust ministeeriumi kantsleri Margus Allikmaaga ja homme loodab saada ühendust ka minister Signe Kiviga .,117,127
allikmaa,LOC,PER,50,50,"Eesti kultuuri rahastamisel on mõeldud liiga palju palkade tõstmisele ja liiga vähe "" majadele "" , leiab kultuuriminister Margus Allikmaa .",129,137
allikmaa,LOC,PER,50,50,"TALLINN , 13. mai ( EPLO ) - Tallinna linnavolikogu vabastas ametist abilinnapead Margus Allikmaa ja Aivar Pärna ning kinnitas nende asemel linnavalituse liikmeteks Tatjana Muravjova ja Kaia Jäppineni .",89,97
allikmaa,LOC,PER,50,50,"Nõukogu koosseisu kuuluvad kultuuriministeeriumi poolt tuntud teatrijuhid Margus Allikmaa ja Eino Baskin , Tallinna linnavalitsuse poolt Mait Metsamaa ja Priit Aimla , panga poolt Ott Karolin .",81,89
allikmaa,LOC,PER,50,50,"Töörühma esimees , kultuuriministeeriumi kantsler Margus Allikmaa ütles , et kahe teatri ühendamise kasuks rääkis võimalus raha kokku hoida .",57,65
allikmaa,LOC,PER,50,50,""" Sellest mahust peab Endla kindlasti loobuma , "" ütles kultuuriministeeriumi kantsler Margus Allikmaa tookord . """,94,102
allikmaa,LOC,PER,50,50,"Viidates kultuuriministeeriumi kantsleri Margus Allikmaa eelnevale töökohale Trio raadiojaamade grupis , märkis Saarna , et R2 müük on "" teatud huvigruppide "" soov .",48,56
allikmaa,LOC,PER,50,50,Märtsis alaealiste komisjonide töö tõhustamiseks abilinnapea Margus Allikmaa juurde moodustatud ajutine töörühm saatis linnavalitsusse nimekirja soovitustest .,68,76
allikmaa,LOC,PER,50,50,"Kultuuriministeeriumi kantsler Margus Allikmaa soovitab pealinlastel tuua need kultuuriministeeriumi ( Tallinn , Suur-Karja 23 , sekretäri telefon 628 22 02 ) , kust raamatud Kihnu edasi toimetatakse .",38,46
allikmaa,LOC,PER,50,50,"Kultuuriministeeriumi kantsleri Margus Allikmaa arvates pole õige , et ministeerium omab 10 000-ruutmeetrist kinnisvara Tallinna kesklinnas , kusjuures üle 8000 ruutmeetri majast on välja renditud mitmekordsete lepingutega .",39,47
allikmaa,LOC,PER,50,50,Poliitiline kokkulepe - Rain Tamm nõukogu esimeheks ja Margus Allikmaa uue ringhäälingu juhatuse esimeheks - vähemalt esimeses etapis vett ei pidanud .,62,70
allikmaa,LOC,PER,50,50,"Margus Allikmaa , Eesti Raadio juhatuse esimees : Arvuti ja liinid kuuluvad ju tööandjale",7,15
allikmaa,LOC,PER,50,50,"Komisjoni esimeheks saab abilinnapea Rein Lang ning komisjoni hakkavad kuuluma Kultuuriministeeriumi kantsler Margus Allikmaa , Eesti Teatriliidu esimees Rein Oja , Teatrijuhtide liidu esimees Indrek Saar , Linnateatri näitlejate usaldusisik Allan Noormets , Kultuuriministeeriumi teatrinõunik Reet Weidebaum ja Tallinna Kultuuriväärtuste Ameti juhataja Agne Trummal .",117,125
allikmaa,LOC,PER,50,50,"Peasissekäigust vasakule pargi poole jääv teatrile kuuluv maa tundus teatri juhi Margus Allikmaa sõnutsi sobivat väikese restorani , baari või ööklubi ehitamiseks .",88,96
allikmaa,LOC,PER,50,50,17. jaanuar 2003 : kultuuriminister Margus Allikmaa hindab rahapuuduse Eesti teatrites kommertslavastuste suure osakaalu ja teatrite vastutustundetu juhtimise süüks,43,51
allikmaa,LOC,PER,50,50,"Kultuuriminister Margus Allikmaa on siiski lubanud , et kultuuriministeerium annab raha hoidla kolmanda etapi ehituseks .",24,32
allikmaa,LOC,PER,50,50,"See sündis kuu aja jooksul ning pidasime kohtumisi näitlejatega , ma kohtusin kaks korda Karusooga , ühe korra kohtus temaga vastne kantsler Margus Allikmaa ning meile sai selgeks , et kompromiss on võimalik .",148,156
allikmaa,LOC,PER,50,50,Abilinnapea Margus Allikmaa sõnul on linn nõus jäähokihuvilistele raha andma .,19,27
allikmaa,LOC,PER,50,50,"Kultuuriminister Margus Allikmaa ütles , et plaanid on veel nii toored , et rahastaja taustast lähemalt rääkida ei saa .",24,32
allikmaa,LOC,PER,50,50,Käesoleva aasta 20. veebruari korraldusega tegi Vabariigi Valitsus ettepaneku arvata nõukogu koosseisust välja senine Kultuuriministeeriumi esindaja Henn Vallimäe ja määrata tema asemel nõukogu liikmeks Kultuuriministeeriumi kantsler Margus Allikmaa .,241,249
allikmaa,LOC,PER,50,50,Käesoleva aasta 20. veebruaril tegi Vabariigi Valitsus korraldusega nr 118-k Riigikogule ettepaneku kutsuda nimetatud nõukogust tagasi Kultuuriministeeriumi esindaja Henn Vallimäe ja nimetada nõukogu uueks liikmeks Kultuuriministeeriumi kantsler Margus Allikmaa .,253,261
allikmaa,LOC,PER,50,50,Margus Allikmaa on kantsler .,7,15
allikmaa,LOC,PER,50,50,"Küll võin aga kolleegidele meelde tuletada , et praegune nõukogu liikme kandidaat Margus Allikmaa ei ole ainuke kantsler selles nõukogus , vaid sinna kuuluvad ka Sotsiaalministeeriumi kantsler , Rahandusministeeriumi kantsler , Keskkonnaministeeriumi kantsler ja Sotsiaalministeeriumi kantsler , kes kõik on seni nõukogus oma ülesannetega suurepäraselt hakkama saanud .",89,97
allikmaa,LOC,PER,50,50,"Teisi kandidaate ei olnud , oli ainult Vabariigi Valitsuse esitatud Kultuuriministeeriumi kantsler Margus Allikmaa .",106,114
allikmaa,LOC,PER,50,50,"Võib arvata , et see ajendas Vabariigi Valitsust pakkuma uueks liikmeks kantsler Margus Allikmaad .",88,97
allikmaa,LOC,PER,50,50,"Muidugi on Margus Allikmaa väga suur asjatundja nendel aladel ja tal on hiilgavaid mõtteid , näiteks see , kuidas ministeeriumid võiksid avalik-õiguslikust televisioonist saateid tellida , et see oleks poliitiliselt väga õige .",18,26
allikmaa,LOC,PER,50,50,"Rein Lang : Rudolph Giuliani , Siim Kallas , Andrus Ansip , Toivo Ninnas , Anders Tsahkna , Margus Allikmaa ja teie alandlik teener .",99,107
allikmaa,LOC,PER,50,50,"Ta on endast väljas pärast seda , kui kultuuriministeeriumi kantsler Margus Allikmaa arvas , et peab kõige tõenäolisemaks uueks teatrijuhiks Allikut .",76,84
allikmaa,LOC,PER,50,50,"Draamateatri valimiskomisjoni kuuluvad kultuuriministeeriumi kantsler Margus Allikmaa , teatrinõunik Reet Weidebaum , eelarve osakonna juhataja Linda Sade , kunstide osakonna juhataja Reet Mikkel , Teatrijuhtide Liidu esindajana Vanemuise direktor Jaak Viller , Teatriliidu esimees Rein Oja , Riigikogu kultuurikomisjoni liige Paul-Erik Rummo , Draamateatri loomenõukogu liige , näitlejate usaldusisik Enn Nõmmik ja Tallinna kultuuriväärtuste ameti juhataja asetäitja Külli Holsting .",77,85
allikmaa,LOC,PER,50,50,"Haridusminister Jaak Aaviksoo nimetas veebruaris EMA kuratooriumi liikmeteks Margus Allikmaa , Ain Heinaru , ülo Jaaksoo , Märt Kubo , Rein Langi , Toomas Lumani , Andres Põderi , Henn Pärna , Reet Remmeli , Vardo Rumesseni ja Arvo Volmeri .",84,92
allikmaa,LOC,PER,50,50,"Abilinnapea Margus Allikmaa sõnul on ta näinud e-kooli projektis osalevates koolides väga erinevaid tulemusi . """,19,27
allikmaa,LOC,PER,50,50,""" Praegu me Tondiraba kooli veel ei sulge , kuid vaatame otsuse üle järgmisel aastal , "" ütles abilinnapea Margus Allikmaa eile .",114,122
allikmaa,LOC,PER,50,50,Koolid peavad haridust kureeriva abilinnapea Margus Allikmaa sõnul avama 50 kohta esimeses klassis ning garanteerima ka suletava Katleri kooli piirkonna õpilastele 5-7 kohta .,52,60
allikmaa,LOC,PER,50,50,Eesti Raadio juht Margus Allikmaa tegi seoses juhtunuga avalduse keskkriminaalpolitseile .,25,33
allikmaa,LOC,PER,50,50,"Kunstimuuseumi Ehituse Sihtasutuse nõukogu liige ja kultuuriministeeriumi kantsler Margus Allikmaa ütles , et ostu-müügileping Vemarroga on sõlmitud ning omand neile üle antud .",90,98
allikmaa,LOC,PER,50,50,Väidetavalt soovib esmaspäeval Eesti Raadio uueks juhatuse esimeheks valitud endine kultuuriminister ja praegune Tallinna abilinnapea Margus Allikmaa oma meeskonnas näha programmidirektori kohal Sulev Valnerit .,141,149
allikmaa,LOC,PER,50,50,"“ Loobusime konkursi korraldamisest , sest aasta algul tehtud konkurss ei andnud tulemusi , ” ütles ETAle konkursikomisjoni esimees Margus Allikmaa .",139,147
allikmaa,LOC,PER,50,50,"Kokku sai kiri 69 allkirja , teiste hulgas riigikogu aseesimehelt Toomas Savilt , Tallinna abilinnapealt Margus Allikmaalt , Kaitseliidu peakaplanilt Tõnis Nõmmikult jpt .",112,122
allikmaa,LOC,PER,50,50,"Eile allkirjastasid alaliidu president Neinar Seli , kultuuriminister Urmas Paet ja Tallinna abilinnapea Margus Allikmaa hea tahte lepingu tabloo ostmiseks .",112,120
allikmaa,LOC,PER,50,50,"Näitekunsti sihtkapitali nõukogu : ülev Aaloe , Margus Allikmaa , Anu Lamp , Reet Mikkel , Ain Mäeots , Reet Neimar , ülle Ulla .",55,63
allikmaa,LOC,PER,50,50,"Majja sisenev ministeeriumi kantsler Margus Allikmaa peatub valvelaua juures , vaatab sulelist "" kolleegi "" ja kiidab : "" Ilus lind . """,44,52
allikmaa,LOC,PER,50,50,""" Maakonnamuuseumid peavad muutuma eriilmelisteks ning Palmse mõisasüdames asuv muuseum seda kindlasti oleks , "" põhjendas kultuuriministeeriumi kantsler Margus Allikmaa .",161,169
allikmaa,LOC,PER,50,50,Stenbocki majas toimuval vastuvõtul osaleb ka kultuuriminister Margus Allikmaa .,70,78
allikmaa,LOC,PER,50,50,Kultuuriministeeriumi kantsleri Margus Allikmaa sõnul käib Kihnu volikogu heaks kiidetud eskiisprojekti järgi saarele rahvamaja ehitus üle jõu ja kihnlastel tuleb tellida uus projekt .,39,47
allikmaa,LOC,PER,50,50,"Tallinna linnavalitsuse delegatsiooni koosseisu kuuluvad linnapea Edgar Savisaar , linnasekretär Toomas Sepp , abilinnapead Margus Allikmaa , Toomas Vitsut , Aivar Pärna , Jüri Ratas , Toivo Ninnas , linnakantselei infotehnoloogia teenistuse direktor Väino Olev , linnapea majandusnõunik Heido Vitsur ning linnakantselei välissuhete- ja eurointegratsiooni osakonna juhataja Heili Luik ning eurointegratsiooni büroo juhataja Hedi Pikk , teatas Raepress .",131,139
allikmaa,LOC,PER,50,50,"Ehitusinsener Heino Uuetalu on teinud 17. sajandil rajatud kaitsekäikudes ekskursioone kahele linnapeale - Edgar Savisaarele ja Tõnis Paltsule , viimasena käis kõrgematest võimukandjatest tunnelites endine kultuuri eest vastutav abilinnapea Margus Allikmaa . """,248,256
allikmaa,LOC,PER,50,50,"Eriti kahetsusväärse repliigiga esines samas lehes kultuuriministeeriumi kantsler Margus Allikmaa , kes on valmis koos ETVga allavett laskma ka Eesti Raadio .",89,97
allikmaa,LOC,PER,50,50,Eda Allikmaa,4,12
